userEmail,opportunitySlug,status,message,startDate,duration
user1@example.com,organic-vegetable-farming,PENDING,我對有機農業非常有興趣，希望能夠學習永續農業的技術和理念。我有基本的園藝經驗，期待能在貴農場學習更多。,2023-07-01,30
user2@example.com,eco-tour-volunteer,ACCEPTED,我熱愛大自然，也喜歡與人分享知識。我有豐富的戶外活動經驗，希望能成為生態村的一份子，向訪客介紹永續生活方式。,2023-07-15,60
user3@example.com,homestay-reception,CONFIRMED,我在服務業工作多年，擅長與人溝通。我對花蓮的自然環境和文化很感興趣，希望能在民宿工作的同時探索當地。,2023-08-01,45
user4@example.com,eco-friendly-farming,REVIEWING,我是一名農業系學生，正在尋找實習機會。我對友善耕作非常有興趣，希望能在實際工作中學習這些技術。,2023-08-15,90
user1@example.com,community-kitchen-assistant,REJECTED,我喜歡烹飪，也對使用當地食材製作料理很有興趣。我希望能在社區廚房學習永續飲食的理念和實踐。,2023-09-01,30
user2@example.com,coastal-conservation,PENDING,我對海洋保育工作充滿熱情，希望能參與海灘清理和生態調查。我有潛水證照，可以協助水下環境調查。,2023-09-15,45
user3@example.com,organic-market-marketing,WITHDRAWN,我有行銷和社群媒體經營經驗，希望能協助農場推廣有機產品。我也對有機農業很感興趣，期待能學習相關知識。,2023-10-01,60
user4@example.com,art-festival-assistant,PENDING,我是藝術愛好者，也有活動策劃經驗。我希望能參與藝術節的籌備工作，學習藝術活動的組織和管理。,2023-10-15,30